{
  "brand_name": "FlowMind",
  "value_proposition": "FlowMind combines AI automation with intuitive design to help you focus on what matters",
  "messaging_framework": {
    "key_messages": [
      "Eliminate busywork with AI",
      "Maintain deep focus",
      "Unified workspace"
    ]
  },
  "unified_tone": "professional",
  "launch_date": "2025-01-15",
  "target_audience": "Knowledge workers and freelancers"
}
